{
  "schema": "thoth-mem.import-ranking-report.v1",
  "created_at": "2026-09-03T00:49:13.043Z",
  "strategy": {
    "id": "strict-selected-any-cap5-stable-v1",
    "config_hash": "b3a5b51c95b8aa79a677b8756e7a7bac0dc6aaad84403446ea1a68f14864fa04",
    "plan_manifest_hash": "851fc64ab988e9c9e17d8befa048c0ebbd3eea8a4b94d6ad967a44ed30f5b285"
  },
  "conditions": {
    "warmups": 10,
    "samples": 100,
    "probe_count": 17,
    "imported_memory_count": 1000,
    "top_k": 5
  },
  "control": {
    "strategy_id": "strict-selected-any-cap5-rrf-v1",
    "input_hash": "d52c836dbad13adc0a4f8cc0c537330de3051f1403e62eca4ab830ec99cc1434",
    "latency_ms": {
      "p95": 141.41480000000047,
      "samples": [
        83.4706000000001,
        81.79120000000012,
        84.30750000000035,
        84.11889999999994,
        87.74269999999979,
        91.0627999999997,
        103.46709999999985,
        135.63750000000027,
        126.38180000000011,
        130.33370000000014,
        113.52340000000004,
        106.51000000000022,
        106.73350000000028,
        122.25630000000001,
        105.82140000000027,
        107.8119999999999,
        129.97789999999986,
        132.45100000000002,
        135.80149999999958,
        133.22400000000016,
        117.21009999999933,
        110.01000000000022,
        110.44999999999982,
        109.32270000000062,
        107.0024000000003,
        118.61610000000019,
        129.4948000000004,
        139.11539999999968,
        131.67059999999947,
        132.66300000000047,
        109.86779999999999,
        112.93029999999999,
        110.30589999999938,
        108.36380000000008,
        118.24330000000009,
        115.26279999999952,
        128.4939999999997,
        131.14879999999994,
        135.20560000000023,
        122.55400000000009,
        106.41460000000006,
        118.96439999999984,
        113.08839999999964,
        109.26729999999952,
        112.20730000000003,
        121.90459999999985,
        126.49009999999998,
        126.45330000000013,
        128.29669999999987,
        133.2572,
        117.91669999999976,
        116.50530000000072,
        120.07179999999971,
        124.75430000000051,
        115.27269999999953,
        110.21889999999985,
        134.27590000000055,
        141.41480000000047,
        145.34780000000137,
        127.58590000000004,
        121.19490000000042,
        103.83979999999974,
        103.69800000000032,
        107.46479999999974,
        114.65190000000075,
        103.40949999999975,
        130.32530000000042,
        136.91020000000026,
        147.15030000000115,
        135.40279999999984,
        125.1234999999997,
        108.98199999999997,
        105.04870000000119,
        109.9332000000013,
        111.40279999999984,
        115.02640000000065,
        123.05839999999989,
        136.88739999999962,
        132.3665000000001,
        135.9362999999994,
        136.17000000000007,
        98.60079999999834,
        108.92580000000089,
        120.24059999999918,
        118.84530000000086,
        108.1198000000004,
        114.53690000000097,
        135.90060000000085,
        144.51679999999942,
        145.91189999999915,
        138.3173999999999,
        135.8163999999997,
        129.97240000000056,
        124.18409999999858,
        113.69789999999921,
        128.02900000000045,
        108.76869999999872,
        147.91949999999997,
        137.20739999999932,
        137.38999999999942
      ]
    },
    "diagnostics": {
      "recall_calls": 1700,
      "ranked_fts_rows": 17000,
      "fused_lexical_rows": 8500,
      "hydrated_memory_rows": 8500
    }
  },
  "candidate": {
    "strategy_id": "strict-selected-any-cap5-stable-v1",
    "input_hash": "d52c836dbad13adc0a4f8cc0c537330de3051f1403e62eca4ab830ec99cc1434",
    "latency_ms": {
      "p95": 173.4777000000031,
      "samples": [
        157.07330000000002,
        122.61250000000109,
        130.46299999999974,
        147.60709999999926,
        160.77809999999954,
        157.29079999999885,
        140.49800000000323,
        145.0676999999996,
        140.245600000002,
        155.3050000000003,
        153.40999999999985,
        146.1836000000003,
        131.89530000000013,
        116.58970000000045,
        131.3777000000009,
        142.8136999999988,
        153.63519999999698,
        166.9962000000014,
        170.61169999999765,
        162.71489999999903,
        168.6146000000008,
        152.84070000000065,
        146.76490000000194,
        143.89140000000043,
        114.33250000000044,
        126.05579999999827,
        141.82359999999971,
        134.42779999999766,
        131.74340000000302,
        141.46570000000065,
        142.61030000000028,
        150.41839999999866,
        134.66839999999866,
        154.24980000000141,
        142.3876999999993,
        145.4152000000031,
        127.0434000000023,
        125.70369999999821,
        137.60970000000088,
        154.19520000000193,
        151.6359999999986,
        167.51140000000305,
        168.2572,
        173.4777000000031,
        145.91200000000026,
        165.03880000000208,
        154.13969999999972,
        134.76810000000114,
        126.6014000000032,
        136.01870000000054,
        147.79490000000078,
        151.61189999999988,
        145.85570000000007,
        151.26840000000084,
        154.16209999999774,
        153.4369000000006,
        157.8607000000011,
        164.26750000000175,
        152.59330000000045,
        124.82990000000063,
        124.49269999999888,
        141.16479999999865,
        146.53000000000247,
        144.83979999999792,
        147.16200000000026,
        146.5235999999968,
        146.54490000000078,
        150.22649999999703,
        149.38950000000114,
        133.68349999999919,
        121.12770000000091,
        99.53250000000116,
        111.78190000000177,
        146.59789999999703,
        191.80850000000282,
        170.33770000000004,
        166.5084999999999,
        175.0139999999992,
        176.01650000000154,
        145.6127000000015,
        125.89909999999873,
        146.9835000000021,
        112.21110000000044,
        108.84539999999834,
        129.2510000000002,
        148.60959999999977,
        165.29520000000048,
        140.02179999999862,
        141.4369000000006,
        149.91050000000178,
        199.50950000000012,
        227.10239999999976,
        158.4880000000012,
        147.3621000000021,
        139.25339999999778,
        132.87390000000232,
        135.935300000001,
        159.3885999999984,
        167.314699999999,
        134.33829999999944
      ]
    },
    "diagnostics": {
      "recall_calls": 1700,
      "ranked_fts_rows": 10600,
      "fused_lexical_rows": 8500,
      "hydrated_memory_rows": 8500
    }
  },
  "stability": {
    "before_rankings": [
      [
        "8eb15ae8-908f-540d-a67a-a2855cfd1687",
        "776f59ac-af86-54ed-a7bf-7faeef646e13",
        "3921bff6-be84-5add-a776-ee032e433ed1",
        "4134c60d-2298-593a-aec8-b35c0cf9377d",
        "43338f53-7d37-5825-a99b-a6821bcb9be3"
      ],
      [
        "cc0329c5-246a-52fa-a89f-b76d27f01ffa",
        "776f59ac-af86-54ed-a7bf-7faeef646e13",
        "3921bff6-be84-5add-a776-ee032e433ed1",
        "4134c60d-2298-593a-aec8-b35c0cf9377d",
        "43338f53-7d37-5825-a99b-a6821bcb9be3"
      ],
      [
        "4e88a890-1770-55a9-a653-110cb5cc1d64",
        "776f59ac-af86-54ed-a7bf-7faeef646e13",
        "3921bff6-be84-5add-a776-ee032e433ed1",
        "4134c60d-2298-593a-aec8-b35c0cf9377d",
        "43338f53-7d37-5825-a99b-a6821bcb9be3"
      ],
      [
        "42cb3fa4-30bc-5b34-a58d-a14de7fd2101",
        "776f59ac-af86-54ed-a7bf-7faeef646e13",
        "3921bff6-be84-5add-a776-ee032e433ed1",
        "4134c60d-2298-593a-aec8-b35c0cf9377d",
        "43338f53-7d37-5825-a99b-a6821bcb9be3"
      ],
      [
        "debceb3b-6122-52fc-aa12-c60310bcd643",
        "776f59ac-af86-54ed-a7bf-7faeef646e13",
        "3921bff6-be84-5add-a776-ee032e433ed1",
        "4134c60d-2298-593a-aec8-b35c0cf9377d",
        "43338f53-7d37-5825-a99b-a6821bcb9be3"
      ],
      [
        "bb2adbd8-e1bc-5d3a-a791-0a8303162c70",
        "776f59ac-af86-54ed-a7bf-7faeef646e13",
        "3921bff6-be84-5add-a776-ee032e433ed1",
        "4134c60d-2298-593a-aec8-b35c0cf9377d",
        "43338f53-7d37-5825-a99b-a6821bcb9be3"
      ],
      [
        "7b944512-a9c3-5fa2-a4e8-4f7e84fa6b68",
        "776f59ac-af86-54ed-a7bf-7faeef646e13",
        "3921bff6-be84-5add-a776-ee032e433ed1",
        "4134c60d-2298-593a-aec8-b35c0cf9377d",
        "43338f53-7d37-5825-a99b-a6821bcb9be3"
      ],
      [
        "be0df3c2-5842-5275-aa66-243fd2585842",
        "776f59ac-af86-54ed-a7bf-7faeef646e13",
        "3921bff6-be84-5add-a776-ee032e433ed1",
        "4134c60d-2298-593a-aec8-b35c0cf9377d",
        "43338f53-7d37-5825-a99b-a6821bcb9be3"
      ],
      [
        "d22d6cbe-be28-5d3d-acd8-ec3792d5f8f2",
        "776f59ac-af86-54ed-a7bf-7faeef646e13",
        "3921bff6-be84-5add-a776-ee032e433ed1",
        "4134c60d-2298-593a-aec8-b35c0cf9377d",
        "43338f53-7d37-5825-a99b-a6821bcb9be3"
      ],
      [
        "1a23fdc9-fcb0-544d-a3eb-e7dd0a2485cd",
        "776f59ac-af86-54ed-a7bf-7faeef646e13",
        "3921bff6-be84-5add-a776-ee032e433ed1",
        "4134c60d-2298-593a-aec8-b35c0cf9377d",
        "43338f53-7d37-5825-a99b-a6821bcb9be3"
      ],
      [
        "e02304f3-196d-5454-a5d7-e78b4618933a",
        "776f59ac-af86-54ed-a7bf-7faeef646e13",
        "3921bff6-be84-5add-a776-ee032e433ed1",
        "4134c60d-2298-593a-aec8-b35c0cf9377d",
        "43338f53-7d37-5825-a99b-a6821bcb9be3"
      ],
      [
        "c253226b-9adc-54a2-a284-5dc6d29c0e2b",
        "776f59ac-af86-54ed-a7bf-7faeef646e13",
        "3921bff6-be84-5add-a776-ee032e433ed1",
        "4134c60d-2298-593a-aec8-b35c0cf9377d",
        "43338f53-7d37-5825-a99b-a6821bcb9be3"
      ],
      [
        "037804e1-88dc-5ca7-adb2-923a08989ed6",